{
  "id": "workpack-manager_core-architecture_02",
  "group": "workpack-manager",
  "title": "VS Code Extension Core Architecture",
  "summary": "Design and implement the core architecture: TypeScript data models, parser/indexer with v5 fallback, multi-root workspace discovery, status reconciliation, dependency graph resolver, and extension scaffold.",
  "protocol_version": "6",
  "workpack_version": "1.0.0",
  "category": "feature",
  "created_at": "2026-02-23",
  "requires_workpack": ["workpack-manager_protocol-v6_01"],
  "tags": ["extension", "architecture", "parser", "data-models", "typescript"],
  "owners": [],
  "repos": ["WorkpackManager"],
  "delivery_mode": "pr",
  "target_branch": "main",
  "prompts": [
    {
      "stem": "A0_bootstrap",
      "agent_role": "Extension scaffold setup (package.json, tsconfig, activation)",
      "depends_on": [],
      "repos": ["WorkpackManager"],
      "estimated_effort": "S"
    },
    {
      "stem": "A1_data_models",
      "agent_role": "TypeScript data models and interfaces for Protocol v6",
      "depends_on": ["A0_bootstrap"],
      "repos": ["WorkpackManager"],
      "estimated_effort": "M"
    },
    {
      "stem": "A2_parser_indexer",
      "agent_role": "Workpack parser/indexer with meta.json primary and markdown fallback",
      "depends_on": ["A1_data_models"],
      "repos": ["WorkpackManager"],
      "estimated_effort": "L"
    },
    {
      "stem": "A3_state_reconciliation",
      "agent_role": "Status reconciliation engine (state.json vs outputs/ vs 99_status.md)",
      "depends_on": ["A1_data_models"],
      "repos": ["WorkpackManager"],
      "estimated_effort": "M"
    },
    {
      "stem": "A4_dependency_graph",
      "agent_role": "Dependency graph resolver with cycle detection",
      "depends_on": ["A1_data_models"],
      "repos": ["WorkpackManager"],
      "estimated_effort": "M"
    },
    {
      "stem": "A5_integration_meta",
      "agent_role": "V1 verification gate: compile, test, lint, AC cross-check",
      "depends_on": ["A1_data_models", "A2_parser_indexer", "A3_state_reconciliation", "A4_dependency_graph"],
      "repos": ["WorkpackManager"],
      "estimated_effort": "M"
    },
    {
      "stem": "R1_retrospective",
      "agent_role": "Post-merge retrospective",
      "depends_on": ["A5_integration_meta"],
      "repos": ["WorkpackManager"],
      "estimated_effort": "S"
    }
  ]
}
