{
  "id": "2026-02-23_feature_extension-agent-integration",
  "title": "VS Code Extension Agent Integration Layer",
  "summary": "Build the agent provider abstraction, Copilot and Codex provider implementations, provider registry, assignment model, and DAG-aware execution orchestrator.",
  "protocol_version": "6",
  "workpack_version": "1.0.0",
  "category": "feature",
  "created_at": "2026-02-23",
  "requires_workpack": ["2026-02-23_feature_extension-core-architecture"],
  "tags": ["extension", "agents", "copilot", "codex", "orchestration"],
  "owners": [],
  "repos": ["WorkpackManager"],
  "delivery_mode": "pr",
  "target_branch": "main",
  "prompts": [
    { "stem": "A0_bootstrap", "agent_role": "Branch setup and prerequisite check", "depends_on": [], "repos": ["WorkpackManager"], "estimated_effort": "XS" },
    { "stem": "A1_provider_interface", "agent_role": "AgentProvider interface, capability model, provider registry", "depends_on": ["A0_bootstrap"], "repos": ["WorkpackManager"], "estimated_effort": "M" },
    { "stem": "A2_copilot_provider", "agent_role": "GitHub Copilot provider using VS Code language model API", "depends_on": ["A1_provider_interface"], "repos": ["WorkpackManager"], "estimated_effort": "M" },
    { "stem": "A3_codex_provider", "agent_role": "Codex provider using OpenAI API", "depends_on": ["A1_provider_interface"], "repos": ["WorkpackManager"], "estimated_effort": "M" },
    { "stem": "A4_assignment_orchestrator", "agent_role": "Assignment model and DAG-aware execution orchestrator", "depends_on": ["A1_provider_interface"], "repos": ["WorkpackManager"], "estimated_effort": "L" },
    { "stem": "A5_integration_meta", "agent_role": "V1 verification gate", "depends_on": ["A1_provider_interface", "A2_copilot_provider", "A3_codex_provider", "A4_assignment_orchestrator"], "repos": ["WorkpackManager"], "estimated_effort": "M" },
    { "stem": "R1_retrospective", "agent_role": "Post-merge retrospective", "depends_on": ["A5_integration_meta"], "repos": ["WorkpackManager"], "estimated_effort": "S" }
  ]
}
