{
  "id": "03_workpack-manager-v2_marketplace-publishing",
  "title": "Marketplace Publishing",
  "summary": "Prepare WorkpackManager for public release. Configure VSIX packaging with marketplace metadata, prepare `@workpack/protocol` for npm publication, create GitHub Actions CI/CD pipelines for automated validation and release, and polish documentation and assets for marketplace listing.",
  "protocol_version": "3.0.0",
  "workpack_version": "1.0.0",
  "category": "feature",
  "created_at": "2026-03-03",
  "requires_workpack": [
    "01_workpack-manager-v2_execution-wiring",
    "02_workpack-manager-v2_extension-consolidation",
    "02_workpack-manager-v2_test-coverage-hardening"
  ],
  "tags": [],
  "owners": [],
  "repos": [
    "WorkpackManager"
  ],
  "delivery_mode": "pr",
  "target_branch": "master",
  "prompts": [
    {
      "stem": "A0_bootstrap",
      "agent_role": "Create feature branch, audit current packaging state",
      "depends_on": [],
      "repos": [
        "WorkpackManager"
      ],
      "estimated_effort": "XS"
    },
    {
      "stem": "A1_vsix_packaging",
      "agent_role": "Configure VSIX packaging: .vscodeignore, build scripts, icon, marketplace metadata",
      "depends_on": [
        "A0_bootstrap"
      ],
      "repos": [
        "WorkpackManager"
      ],
      "estimated_effort": "M"
    },
    {
      "stem": "A2_npm_publish_protocol",
      "agent_role": "Prepare @workpack/protocol for npm: files field, private:false, README, bin exports",
      "depends_on": [
        "A0_bootstrap"
      ],
      "repos": [
        "WorkpackManager"
      ],
      "estimated_effort": "S"
    },
    {
      "stem": "A3_ci_release_pipeline",
      "agent_role": "Create GitHub Actions workflows for CI and release",
      "depends_on": [
        "A1_vsix_packaging",
        "A2_npm_publish_protocol"
      ],
      "repos": [
        "WorkpackManager"
      ],
      "estimated_effort": "M"
    },
    {
      "stem": "A4_readme_marketplace",
      "agent_role": "Restructure README for marketplace, update CHANGELOG, add badges",
      "depends_on": [
        "A1_vsix_packaging"
      ],
      "repos": [
        "WorkpackManager"
      ],
      "estimated_effort": "S"
    },
    {
      "stem": "V1_integration_meta",
      "agent_role": "Verification: VSIX builds, npm pack, CI YAML valid, README sections",
      "depends_on": [
        "A3_ci_release_pipeline",
        "A4_readme_marketplace"
      ],
      "repos": [
        "WorkpackManager"
      ],
      "estimated_effort": "S"
    },
    {
      "stem": "R1_retrospective",
      "agent_role": "Post-merge retrospective",
      "depends_on": [
        "V1_integration_meta"
      ],
      "repos": [
        "WorkpackManager"
      ],
      "estimated_effort": "XS"
    }
  ],
  "group": "workpack-manager-v2"
}
