{
  "id": "03_workpack-protocol_agent-documentation",
  "title": "Agent Documentation",
  "summary": "Create agent-optimized protocol documentation: a compact rule set (`AGENT_RULES.md`), formal state machine diagrams (`AGENT_STATE_MACHINE.md`), and a Python tool that generates structured context JSON for agents to consume before executing prompts. requires_workpack: [02_workpack-protocol_verification-hardening, 02_workpack-protocol_project-config]",
  "protocol_version": "2.0.0",
  "workpack_version": "1.0.0",
  "category": "feature",
  "created_at": "2026-02-23",
  "requires_workpack": [
    "02_workpack-protocol_verification-hardening",
    "02_workpack-protocol_project-config"
  ],
  "tags": [],
  "owners": [],
  "repos": [
    "WorkpackManager"
  ],
  "delivery_mode": "pr",
  "target_branch": "main",
  "prompts": [
    {
      "stem": "A0_bootstrap",
      "agent_role": "Branch setup and context baseline",
      "depends_on": [],
      "repos": [
        "WorkpackManager"
      ],
      "estimated_effort": "XS"
    },
    {
      "stem": "A1_agent_rules",
      "agent_role": "Write AGENT_RULES.md with numbered invariant rules",
      "depends_on": [
        "A0_bootstrap"
      ],
      "repos": [
        "WorkpackManager"
      ],
      "estimated_effort": "M"
    },
    {
      "stem": "A2_agent_state_machine",
      "agent_role": "Write AGENT_STATE_MACHINE.md with state diagrams and decision tree",
      "depends_on": [
        "A0_bootstrap"
      ],
      "repos": [
        "WorkpackManager"
      ],
      "estimated_effort": "M"
    },
    {
      "stem": "A3_agent_context_tool",
      "agent_role": "Build agent_context.py tool for structured context generation",
      "depends_on": [
        "A1_agent_rules"
      ],
      "repos": [
        "WorkpackManager"
      ],
      "estimated_effort": "S"
    },
    {
      "stem": "V1_integration_meta",
      "agent_role": "V1 gate and merge readiness review",
      "depends_on": [
        "A2_agent_state_machine",
        "A3_agent_context_tool"
      ],
      "repos": [
        "WorkpackManager"
      ],
      "estimated_effort": "S"
    },
    {
      "stem": "R1_retrospective",
      "agent_role": "Post-merge retrospective",
      "depends_on": [
        "V1_integration_meta"
      ],
      "repos": [
        "WorkpackManager"
      ],
      "estimated_effort": "S"
    }
  ],
  "group": "workpack-protocol"
}
