{
  "id": "02_workpack-protocol_project-config",
  "title": "Project Config",
  "summary": "Define a project-level configuration file (`workpack.config.json`) with JSON Schema, integrate it into all Python tools, and enhance workpack discovery to support multi-root workspaces and custom workpack directories. requires_workpack: [01_workpack-protocol_prompt-lifecycle]",
  "protocol_version": "2.0.0",
  "workpack_version": "1.0.0",
  "category": "feature",
  "created_at": "2026-02-23",
  "requires_workpack": [
    "01_workpack-protocol_prompt-lifecycle"
  ],
  "tags": [],
  "owners": [],
  "repos": [
    "WorkpackManager"
  ],
  "delivery_mode": "pr",
  "target_branch": "main",
  "prompts": [
    {
      "stem": "A0_bootstrap",
      "agent_role": "Branch setup and baseline verification",
      "depends_on": [],
      "repos": [
        "WorkpackManager"
      ],
      "estimated_effort": "XS"
    },
    {
      "stem": "A1_config_schema",
      "agent_role": "Define WORKPACK_CONFIG_SCHEMA.json with all config fields",
      "depends_on": [
        "A0_bootstrap"
      ],
      "repos": [
        "WorkpackManager"
      ],
      "estimated_effort": "S"
    },
    {
      "stem": "A2_config_tool_integration",
      "agent_role": "Implement config loader and integrate into all Python tools",
      "depends_on": [
        "A1_config_schema"
      ],
      "repos": [
        "WorkpackManager"
      ],
      "estimated_effort": "M"
    },
    {
      "stem": "A3_multi_workspace_discovery",
      "agent_role": "Enhanced multi-root workspace discovery with roots and exclude patterns",
      "depends_on": [
        "A2_config_tool_integration"
      ],
      "repos": [
        "WorkpackManager"
      ],
      "estimated_effort": "M"
    },
    {
      "stem": "V1_integration_meta",
      "agent_role": "V1 integration gate and merge readiness review",
      "depends_on": [
        "A3_multi_workspace_discovery"
      ],
      "repos": [
        "WorkpackManager"
      ],
      "estimated_effort": "S"
    },
    {
      "stem": "R1_retrospective",
      "agent_role": "Post-merge retrospective",
      "depends_on": [
        "V1_integration_meta"
      ],
      "repos": [
        "WorkpackManager"
      ],
      "estimated_effort": "S"
    }
  ],
  "group": "workpack-protocol"
}
