{
  "id": "workpack-manager-v3-pixel-office-ui",
  "title": "Pixel Office Control Room UI",
  "summary": "Deliver the 0.0.3 interactive pixel-art workspace for WorkpackManager, including room-based workpack visualization, animated agent avatars, desk-level assignment and controls, chat-preview hover affordances, and a repository-grouped Git diff side panel.",
  "protocol_version": "3.0.0",
  "workpack_version": "1.0.0",
  "category": "feature",
  "created_at": "2026-03-10",
  "requires_workpack": [],
  "tags": [
    "vscode-extension",
    "pixel-ui",
    "animation",
    "agent-ux",
    "git-diff"
  ],
  "owners": [],
  "repos": [
    "WorkpackManager"
  ],
  "delivery_mode": "pr",
  "target_branch": "master",
  "prompts": [
    {
      "stem": "A0_bootstrap",
      "agent_role": "Baseline the current extension UI architecture, confirm branch context, and define scene/state contracts for the pixel office experience",
      "depends_on": [],
      "repos": [
        "WorkpackManager"
      ],
      "estimated_effort": "S"
    },
    {
      "stem": "A1_pixel_room_shell",
      "agent_role": "Implement the pixel-art room shell that maps a workpack to a room with fixed locations for desks, request, plan, status, outputs, and ambient decoration",
      "depends_on": [
        "A0_bootstrap"
      ],
      "repos": [
        "WorkpackManager"
      ],
      "estimated_effort": "L"
    },
    {
      "stem": "A2_agent_animation_runtime",
      "agent_role": "Create animated agent avatars and bind runtime states so agents appear at desks, move to the output board, and raise a hand for manual input",
      "depends_on": [
        "A0_bootstrap",
        "A1_pixel_room_shell"
      ],
      "repos": [
        "WorkpackManager"
      ],
      "estimated_effort": "L"
    },
    {
      "stem": "A3_desk_interactions_chat_preview",
      "agent_role": "Add desk interactions for assignment and control menus plus hover-driven agent chat previews and runtime affordances",
      "depends_on": [
        "A0_bootstrap",
        "A1_pixel_room_shell"
      ],
      "repos": [
        "WorkpackManager"
      ],
      "estimated_effort": "L"
    },
    {
      "stem": "A4_git_diff_side_panel",
      "agent_role": "Build the side-panel Git diff inspector grouped by repository with full-path file entries and integration hooks from the pixel room UI",
      "depends_on": [
        "A0_bootstrap"
      ],
      "repos": [
        "WorkpackManager"
      ],
      "estimated_effort": "M"
    },
    {
      "stem": "A5_visual_polish_and_motion",
      "agent_role": "Polish the pixel-art presentation with color, layering, animation timing, accessibility fallbacks, and final room composition",
      "depends_on": [
        "A2_agent_animation_runtime",
        "A3_desk_interactions_chat_preview",
        "A4_git_diff_side_panel"
      ],
      "repos": [
        "WorkpackManager"
      ],
      "estimated_effort": "M"
    },
    {
      "stem": "V1_integration_meta",
      "agent_role": "Verify UX behavior, animation states, desk interactions, diff panel behavior, and overall integration readiness for 0.0.3",
      "depends_on": [
        "A5_visual_polish_and_motion"
      ],
      "repos": [
        "WorkpackManager"
      ],
      "estimated_effort": "M"
    },
    {
      "stem": "R1_retrospective",
      "agent_role": "Capture delivery learnings for the pixel office feature after verification",
      "depends_on": [
        "V1_integration_meta"
      ],
      "repos": [
        "WorkpackManager"
      ],
      "estimated_effort": "XS"
    }
  ]
}
