{
  "id": "manual-workpack",
  "title": "Manual Workpack",
  "summary": "Manual registration fixture.",
  "protocol_version": "2.0.0",
  "workpack_version": "1.0.0",
  "category": "feature",
  "created_at": "2026-02-23",
  "requires_workpack": [],
  "tags": ["fixture"],
  "owners": [],
  "repos": ["WorkpackManager"],
  "delivery_mode": "pr",
  "target_branch": "main",
  "prompts": []
}
