{
  "id": "01_workpack-protocol_prompt-lifecycle",
  "title": "Prompt Lifecycle Enhancements (B-series DAG + Commit Tracking)",
  "summary": "Extend the Workpack Protocol with two capabilities: (1) B-series bug-fix prompts can declare dependencies via a DAG, enabling parallel execution and proper ordering; (2) each prompt must commit its changes to the bootstrap branch and record branch name and commit SHA in its output.json, with the integration prompt verifying commit existence and file consistency.",
  "protocol_version": "2.1.0",
  "workpack_version": "1.0.0",
  "category": "feature",
  "created_at": "2026-02-23",
  "group": "workpack-protocol",
  "requires_workpack": [],
  "tags": ["protocol-evolution", "b-series", "commit-tracking", "dag", "verification"],
  "owners": [],
  "repos": ["WorkpackManager"],
  "delivery_mode": "pr",
  "target_branch": "main",
  "prompts": [
    {
      "stem": "A0_bootstrap",
      "agent_role": "Initialize feature branch, verify baseline, read current protocol spec",
      "depends_on": [],
      "repos": ["WorkpackManager"],
      "estimated_effort": "XS"
    },
    {
      "stem": "A1_b_series_dag",
      "agent_role": "Design and implement B-series dependency DAG: spec, schemas, templates, linter",
      "depends_on": ["A0_bootstrap"],
      "repos": ["WorkpackManager"],
      "estimated_effort": "M"
    },
    {
      "stem": "A2_commit_tracking",
      "agent_role": "Design and implement per-prompt commit tracking: output schema, spec, templates",
      "depends_on": ["A0_bootstrap"],
      "repos": ["WorkpackManager"],
      "estimated_effort": "M"
    },
    {
      "stem": "A3_integration_verification",
      "agent_role": "Extend integration prompt pattern to verify commits and file consistency",
      "depends_on": ["A1_b_series_dag", "A2_commit_tracking"],
      "repos": ["WorkpackManager"],
      "estimated_effort": "S"
    },
    {
      "stem": "A5_integration_meta",
      "agent_role": "V1 gate: compile, test, lint, cross-check all acceptance criteria",
      "depends_on": ["A3_integration_verification"],
      "repos": ["WorkpackManager"],
      "estimated_effort": "S"
    }
  ]
}
