{
  "id": "01_sample-group_parser-v6",
  "group": "sample-group",
  "title": "Parser V6 Fixture",
  "summary": "Protocol v6 fixture workpack with metadata and state.",
  "protocol_version": "2.0.0",
  "workpack_version": "1.0.0",
  "category": "feature",
  "created_at": "2026-02-23",
  "requires_workpack": [],
  "tags": ["fixture", "parser"],
  "owners": [],
  "repos": ["WorkpackManager"],
  "delivery_mode": "pr",
  "target_branch": "main",
  "prompts": [
    {
      "stem": "A0_bootstrap",
      "agent_role": "Bootstrap fixture",
      "depends_on": [],
      "repos": ["WorkpackManager"],
      "estimated_effort": "S"
    },
    {
      "stem": "A1_parser",
      "agent_role": "Parser implementation",
      "depends_on": ["A0_bootstrap"],
      "repos": ["WorkpackManager"],
      "estimated_effort": "M"
    }
  ]
}
